{
  "target_audience": "Glasbau-Ingenieure und Fassadenplaner, 32–48 Jahre, DACH, technisch-rationaler Entscheider, hohe Anforderungen an Statik, Bauphysik und Normenkonformität bei Konstruktions- und Sicherheitsglas, enge Abstimmung mit Architektur und Tragwerksplanung",
  "company": {
    "name": "Schott",
    "industry": "industrial_b2b",
    "description": "Internationaler Spezialglas-Hersteller mit Fokus auf technisches und architektonisches Glas: Konstruktionsglas, Sicherheits- und Funktionsglas für Fassaden, Gebäudehülle und anspruchsvolle Bauvorhaben. Messe-Demo: immersive Persona Reality für Fachpublikum Glasbau — echeon, CHECKION, AUDION als Erlebnisschicht ohne Live-API."
  },
  "language": "de",
  "session_label": "Markus Weber — Glasbau-Ingenieur Schott"
}
