{
  "target_audience": "Instandhaltungsleiter und Betriebsingenieure in der Lebensmittel- und Getränkeproduktion, 38–52 Jahre, DACH, pragmatisch-rational, Verantwortung für Anlagenverfügbarkeit und Hygiene-Audit. Themen: ungeplante Stillstände, Sensorik und Predictive Maintenance, Reinigungs-/CIP-Zyklen, Dokumentation für Audits (IFS, BRC), knappe Ersatzteile, Nacht- und Wochenend-Einsätze.",
  "company": {
    "name": "SICK AG",
    "industry": "industrial_b2b",
    "description": "Hersteller von Sensorik und Lösungen für industrielle Automatisierung (Objekterkennung, Füllstand, Sicherheit, Qualitätskontrolle an Förderlinien). Messe-Demo: Persona Reality zeigt einen Produktionstag aus Sicht des Instandhalters; im Hintergrund echeon (Branchen- und Störungs-Signale), CHECKION (digitale Sichtbarkeit des Betriebs/Anbieters), AUDION (innere Belastung durch Ausfallrisiko)."
  },
  "language": "de",
  "session_label": "Thomas Berger — Instandhaltungsleiter Lebensmittelproduktion SICK"
}
