{
  "target_audience": "Hausverwalter in der WEG-Verwaltung, 42–55 Jahre, DACH, rationaler Entscheider, hohe Regulatory- und Nebenkosten-Themen, SHK- und Energieeffizienz im Bestand",
  "company": {
    "name": "MSQ DX",
    "industry": "it_saas",
    "description": "AI-Produktsuite für Persona Reality: echeon (kuratierter Feed), CHECKION (digitale Sichtbarkeit), AUDION (innere Belastungsmetriken). Messe-Demo ohne Live-API."
  },
  "language": "de",
  "session_label": "Klaus Berger — Golden Pilot"
}
